{
  "schema_version": 1,
  "form_id": "TH_TDAC",
  "version": "2026.09.28-1",
  "last_verified": "2026-09-28",
  "site_version_seen": "2026.09.00-0543",
  "sources": [
    { "id": "tdac_site", "name": "태국 이민국 TDAC 공식 사이트(공개 앱 코드의 입력 칸 이름)", "url": "https://tdac.immigration.go.th/arrival-card/" }
  ],
  "source": "tdac_site",
  "official_url_patterns": ["https://tdac.immigration.go.th/arrival-card/*"],
  "start_url": "https://tdac.immigration.go.th/arrival-card/",
  "submitted_url_contains": "/arrival-card/add/submitted",
  "labels_reviewed": false,
  "steps": [
    {
      "id": "personal",
      "title_ko": "개인 정보",
      "probe": "[formcontrolname=\"familyName\"]",
      "fields": [
        { "key": "passport.surname", "selector": "[formcontrolname=\"familyName\"]", "widget": "text", "transform": "upper",
          "labels": { "ko": "성 (영문)", "en": "Family name", "local": "นามสกุล" }, "source": "passport", "confirm": "bulk", "required": true },
        { "key": "passport.given", "selector": "[formcontrolname=\"firstName\"]", "widget": "text", "transform": "upper",
          "labels": { "ko": "이름 (영문)", "en": "First name", "local": "ชื่อ" }, "source": "passport", "confirm": "bulk", "required": true },
        { "key": "passport.number", "selector": "[formcontrolname=\"passportNo\"]", "widget": "text", "transform": "upper",
          "labels": { "ko": "여권 번호", "en": "Passport No." }, "source": "passport", "confirm": "bulk", "required": true },
        { "key": "passport.nationality", "selector": "[formcontrolname=\"nationalityDesc\"]", "widget": "assist",
          "labels": { "ko": "국적", "en": "Nationality" }, "source": "passport", "confirm": "bulk", "required": true,
          "hint_ko": "목록에서 대한민국을 찾아 골라 주세요" },
        { "key": "passport.birth_date", "selector": null, "widget": "assist",
          "labels": { "ko": "생년월일", "en": "Date of birth" }, "source": "passport", "confirm": "bulk", "required": true,
          "hint_ko": "연도·월·일을 차례로 골라 주세요" },
        { "key": "passport.gender", "selector": "[formcontrolname=\"gender\"]", "widget": "assist",
          "labels": { "ko": "성별", "en": "Gender" }, "source": "passport", "confirm": "bulk", "required": true },
        { "key": "profile.occupation", "selector": "[formcontrolname=\"occupation\"]", "widget": "text", "transform": "upper",
          "labels": { "ko": "직업 (영문)", "en": "Occupation" }, "source": "user_input", "confirm": "individual", "required": true,
          "hint_ko": "예: OFFICE WORKER, STUDENT, RETIRED" },
        { "key": "profile.country_res", "selector": null, "widget": "assist",
          "labels": { "ko": "사는 나라", "en": "Country/Territory of residence" }, "source": "user_input", "confirm": "individual", "required": true,
          "hint_ko": "목록에서 대한민국을 찾아 골라 주세요" },
        { "key": "profile.city_res", "selector": null, "widget": "assist",
          "labels": { "ko": "사는 도시 (영문)", "en": "City/State of residence" }, "source": "user_input", "confirm": "individual", "required": true,
          "hint_ko": "예: SEOUL" },
        { "key": "profile.phone", "selector": "[formcontrolname=\"phoneNo\"]", "widget": "text",
          "labels": { "ko": "휴대폰 번호", "en": "Phone No." }, "source": "user_input", "confirm": "individual", "required": true,
          "hint_ko": "나라 번호는 대한민국(+82)을 골라 주세요" }
      ]
    },
    {
      "id": "trip",
      "title_ko": "여행 정보",
      "probe": "[formcontrolname=\"arrDate\"]",
      "fields": [
        { "key": "trip.arrival_date", "selector": "[formcontrolname=\"arrDate\"]", "widget": "assist",
          "labels": { "ko": "도착 날짜", "en": "Date of arrival", "local": "วันที่เดินทางมาถึง" }, "source": "booking", "confirm": "bulk", "required": true,
          "hint_ko": "달력에서 골라 주세요" },
        { "key": "trip.purpose", "selector": "[formcontrolname=\"traPurposeId\"]", "widget": "assist",
          "labels": { "ko": "여행 목적", "en": "Purpose of travel", "local": "วัตถุประสงค์การเดินทาง" }, "source": "user_choice", "confirm": "individual", "required": true,
          "options_ref": "purpose" },
        { "key": "trip.arrival_mode", "selector": "[formcontrolname=\"traModeId\"]", "widget": "assist",
          "labels": { "ko": "오는 방법", "en": "Mode of travel" }, "source": "booking", "confirm": "bulk", "required": true,
          "hint_ko": "비행기를 골라 주세요" },
        { "key": "trip.flight_no", "selector": "[formcontrolname=\"flightNo\"]", "widget": "text", "transform": "upper",
          "labels": { "ko": "도착 편명", "en": "Flight No./Vehicle No." }, "source": "booking", "confirm": "bulk", "required": true },
        { "key": "trip.departure_date", "selector": "[formcontrolname=\"deptDate\"]", "widget": "assist",
          "labels": { "ko": "떠나는 날짜", "en": "Date of departure" }, "source": "booking", "confirm": "bulk", "required": false,
          "hint_ko": "달력에서 골라 주세요" },
        { "key": "trip.departure_flight_no", "selector": "[formcontrolname=\"deptFlightNo\"]", "widget": "text", "transform": "upper",
          "labels": { "ko": "떠나는 편명", "en": "Flight No./Vehicle No." }, "source": "booking", "confirm": "bulk", "required": false }
      ]
    },
    {
      "id": "stay",
      "title_ko": "숙소",
      "probe": "[formcontrolname=\"accTypeId\"]",
      "fields": [
        { "key": "stay.type", "selector": "[formcontrolname=\"accTypeId\"]", "widget": "assist",
          "labels": { "ko": "숙소 종류", "en": "Type of accommodation" }, "source": "user_choice", "confirm": "individual", "required": true,
          "options_ref": "stay_type" },
        { "key": "stay.province", "selector": null, "widget": "assist",
          "labels": { "ko": "숙소 주(州)", "en": "Province" }, "source": "user_input", "confirm": "individual", "required": true,
          "hint_ko": "예: BANGKOK — 목록에서 골라 주세요" },
        { "key": "stay.post_code", "selector": "[formcontrolname=\"accPostCode\"]", "widget": "text",
          "labels": { "ko": "숙소 우편번호", "en": "Post code" }, "source": "user_input", "confirm": "individual", "required": false },
        { "key": "stay.address", "selector": "[formcontrolname=\"accAddress\"]", "widget": "text",
          "labels": { "ko": "숙소 주소 (영문)", "en": "Address" }, "source": "user_input", "confirm": "individual", "required": true,
          "hint_ko": "예약 확인서에 적힌 영문 주소를 그대로" }
      ]
    },
    {
      "id": "health",
      "title_ko": "건강 신고",
      "probe": "[formcontrolname=\"yellowFever\"]",
      "note_ko": "최근 다녀온 나라, 예방 접종 같은 건강 질문은 앱이 대신 답하지 않아요. 사이트에서 직접 답해 주세요.",
      "fields": []
    }
  ],
  "checkpoints": [
    { "id": "captcha", "kind": "captcha", "selector": "iframe[src*=\"challenges.cloudflare.com\"]", "ko": "사람인지 확인하는 칸은 직접 눌러 주세요" },
    { "id": "health", "kind": "health", "selector": "[formcontrolname=\"yellowFever\"]", "ko": "건강 질문은 직접 답해 주세요" },
    { "id": "declaration", "kind": "declaration", "selector": "[formcontrolname=\"checkedDecalraion\"]", "ko": "내용이 맞다는 약속이에요. 직접 확인하고 체크해 주세요" },
    { "id": "email", "kind": "email", "selector": "[formcontrolname=\"sendTo\"]", "ko": "확인 메일을 받을 주소를 직접 적어 주세요" },
    { "id": "final_submit", "kind": "final_submit", "selector": "button[type=\"submit\"]", "ko": "마지막 '제출'은 직접 눌러 주세요" }
  ],
  "options": {
    "purpose": [
      { "value": "tourism", "ko": "관광", "en": "Tourism", "local": "ท่องเที่ยว" },
      { "value": "business", "ko": "출장", "en": "Business", "local": "ธุรกิจ" }
    ],
    "stay_type": [
      { "value": "hotel", "ko": "호텔", "en": "Hotel" },
      { "value": "other", "ko": "그 밖의 숙소", "en": "Others" }
    ]
  }
}
